<?xml version="1.0" encoding="UTF-8"?>
<config xmlns:xsi="http://www.w3.org/2001/XMLSchema-instance" xsi:noNamespaceSchemaLocation="../../../../progress_reporter.xsd">
    <jira>
        <url>https://jira.atlassian.com</url>
    </jira>
    <report>
        <marker>#</marker>
        <startProcessingRow>6</startProcessingRow>
        <issueColumns>
            <key>B</key>
        </issueColumns>
        <reportName/>
    </report>
</config>